음식점,리뷰,지도
무명칼국수,칼국수면발이 정말 좋았어요,kakao
무명칼국수,그냥 어디가도 먹을수 있는 평범한 맛  전혀 특별하지 않음,kakao
무명칼국수,해물칼국수 정말 괜찮음 닭칼은 그닥 만두는 부추맛이 강해서 그닥 서울 물가 대비 가성비 미쳤음 양도 많음,kakao
무명칼국수,해물칼국수 닭칼국수 둘다 맛있고 만두 꼭 시켜먹길 추천합니다,kakao
무명칼국수,인생 닭칼국수,kakao
무명칼국수,Strong point 1 쫄깃한 식감의 수타면 2 아삭하고 감칠맛 나는 겉절이 반찬으로만 사가고 싶음  Nice point 1 바쁜데도 친절하셨던 남자 사장님  Weak point 1 바지락에서 모래알이 좀 씹힘 해감이 더 잘 되었으면 좋겠음 2 개인적으로 국물이 조금 짰음  닭칼국수도 먹어봐야겠네요 석계에서 수타칼국수 먹고싶으면 여기로,kakao
무명칼국수,해물과 닭칼국수에서 결정장애였는데 해물칼국수 오랜만에 맛있게 잘 먹었네요 김치도 맛있고 국물시원하고 다음엔 닭칼국수 갑니다,kakao
무명칼국수,김치는 존맛탱이었고 칼국수는 조금 짜서 호불호 갈리긴하는데 전 맛있었음 특히 닭칼국수,kakao
무명칼국수,생각보다 너무 평범했어요ㅜㅜ만두도 칼국수도,kakao
무명칼국수,김치는 너무 달고 육수는 아무 특색이 없음,kakao
무명칼국수,진짜 개맛있다,kakao
무명칼국수,찐맛집 닭칼이랑 해물칼국수 둘다 면이랑 국물 미쳤어요 김치도 대존맛 만두도 진짜임 광운대 가면 무조건 가야되는 맛집 다 친절하시고 가격도 착하다ㅠㅠ,kakao
무명칼국수,윽 저 동신아파트 사는데 걸어서 4분 그냥 저냥 빨리 후루룩 먹고 나와야지 안그러면 그릇 뺐기듯 그냥 가져감이모 그러는거 아냐김치 맛 변했음 안 가,kakao
무명칼국수,맛있지만 짜다 기본간이 짠데 심지어 테이블에 소금이 있음 하다못해 콩국수라도 기본간을 줄여주시면 어떨지,kakao
무명칼국수,김치가 끝내줌,kakao
무명칼국수,우리가족이 모두 국수를 좋아하는 가족이라서 20여년 이용하고 있는데 최고의 칼국수 집입니다 가족이 외식을 이집에서 제일 많이 했답니다,kakao
무명칼국수,꽤 맛좋은 집 해물칼국수 추천 우선 칼국수면발이 아주 쫄깃해서 식감이 좋다 칼국수에 빠질수 없는 중요한 김치도 맛있고 해물칼국수에 황태도 과하지 않게 적당히 들어가서 비리지도 않고 향이 지나치지도 않다 우리동네에도 하나 있었으면 하는 음식점 망하지 않고 잘유지해주길 바라는 음식점,kakao
무명칼국수,맛있는 동네 칼국수집,kakao
무명칼국수,석계 맛집 해물도 닭고 JMT,kakao
무명칼국수,이런 집이 이 동네에 있다는건 축복임  맛 서비스 모두 최고,kakao
무명칼국수,닭 칼국수 괜찮았습니다,kakao
무명칼국수,해물칼국수 깔끔하고 맛있습니다 무엇보다 친절하셔서 기분 좋게 먹었어요,kakao
무명칼국수,무명칼국수진짜 칼국수중에 최고다,kakao
무명칼국수,자주 가는 칼국수 집이에요 ㅎ 맛있어요,kakao
무명칼국수,해물 칼국수좋아요 만두도맛나요 석계역 가면 자주들리는집 국물이좋아서,kakao
무명칼국수,맛있고 친절하세요,kakao
무명칼국수,솔직히 말하면 칼국수는 그냥 그저그런 맛인데 김치가 한몫함,kakao
무명칼국수,난 그냥 그랬는데 같이간 부모님이 맛있다 하심,kakao
무명칼국수,한국사람이라면 무명칼국수 드세요 해물칼국수,kakao
무명칼국수,칼국수 정말 맛있어요 겉절이도 끝내줘요 가족끼리 하는것 같던데 아주머니는 정말 친절한데 아드님들이 좀 불친절함,kakao
무명칼국수,칼국수면 직접 만드시는거 같은데  진짜 쫄깃하고 국물도 시원함 겉절이가 신의 한수 2번 리필함 만두는 조미료맛 없이 집에서 만든 담백한 맛이라  호불호 갈릴듯 근처 방문하시면 추천,kakao
무명칼국수,맛있어요 겉절이도 맛남,kakao
무명칼국수,손칼국수라는거 말고는 맛의 특별함이 없는 집 만두맛도 평범하고  같이 간 지인에게 또 방문하겠냐 물어보니 재방문은 안하겠답니다,kakao
무명칼국수,침착맨 추천 맛집 ㅎㅎ 칼국수도 만두도 정말 직접 손으로 만든다는 느낌이 강한 요즘은 드문 제대로 된 음식점 칼국수 면발도 울퉁불퉁 하지만 넘 쫄깃하니 맛있고 만두도 진짜 왕만한데 소가 잘 되어 있어서 맛있었어요 자극적인 걸 좋아하는 초딩입맛인 제 입장에서 칼국수와 만두라는 삼삼한 메뉴로 4점이면 최고 칭찬인 겁니다 어른 분들은 환장하실 듯,kakao
무명칼국수,해물은 그닥 닭은 무난 김치가 겉절이가 아니라 아쉽,kakao
무명칼국수,맛있어요 결코 다시 닭칼국수  닭칼국수 닭칼국수,kakao
무명칼국수,해물칼국수 맛있음  기본인데 맛있음 김치 살짝 아쉬움  수타면이라 면이 균일하지 않아서 더 맛있음,kakao
무명칼국수,맛있고 비싸지도않고 일하시는분들이 다 친절하심 갈때마다 실망안하는곳,kakao
무명칼국수,진짜 인생맛집 칼국수입니다 면도 직접 만드시고 만두도 직접 만드시고 김치도 직접 만드시고 맛 또한 일품입니다 많이 덥고 바쁘고 힘드실텐데 일하시는 분들 모두 웃는 얼굴로 맞이해주시는 것도 너무 좋았습니다 ㅠㅠ  기다려서 먹어야하지만 꼭 가보시길 추천합니다,kakao
무명칼국수,국물 진짜 시원하고 맛있어요 ㅋㅋㅋ,kakao
무명칼국수,아 너무 맛있음 술 먹고 다음 날 먹으러 갑니다 양은 매우 많고 맛도 좋습니다 다만 사람들이 많다보니 대기가 생기는 편이고 음식이 나올 때까지 시간이 좀 걸려서 빨리 먹고 싶은데 기다리기 힘드네요,kakao
무명칼국수,칼국수 면도 직접 만드시는 것 같은데 면도 맛있고 국물도 맛있어요 특히 개인적으로 닭칼국수 너무 좋아하는데 양도 많고 맛있어서 대 만족 ㅠㅠ 저는 진짜 피크 시간대 완전 피해서 갔는데도 웨이팅은 없었지만 홀은 가득찼더라구요 만두도 넘넘 맛있었어요 ㅠ ㅠ ㅠ ㅠ 일단 김치도 맛있었어요 ,kakao
무명칼국수,검색하고 별 기대안하고 간 집인데 칼국수 맛집이네요 칼국수의 조미료맛이 거의 안나고 국물이 시원합니다 그리고 만두도 기대이상입니다 배부르게 먹고 속 더부룩함 없이 소화도 잘되었네요 맛집이라 그런지 점심시간에 가서 웨이팅이 조금있었지만 직원분들도 친절해서 더욱 좋았네요,kakao
무명칼국수,석계 맛집 특히 면과 겉절이가 맛있다 웨이팅이 좀 있지만  기다릴만 하다,kakao
무명칼국수,두 번 다시는 가고 싶지 않은 맛,kakao
무명칼국수,주변 검색해서 발견했는데 맛집인지 2팀 대기후 자리에 앉았음 직접 반죽해서 썰은 면발은 꼬들꼬들해서 맛있는 편 전 이보다 풀어진 면발을 좋아하는 편이라 해물 육수 심심하고 겉절이도 쏘쏘 합니다 만두도 직접 빚은 건데속도 다 들었는데 23 뭔가 부족합니다 전체적으로 전 그냥그냥 했네요,kakao
무명칼국수,닭칼국수간이 좀 세고 손은 느리시지만 김치가 넘 맛있고 칼수면발이 진짜 찰지고맛나서 한번씩 생각나서 가게됨  가격도 착한편,kakao
무명칼국수,여기 진짜 찐맛집인생 칼국수집 석계갈일 없는데 바지락칼국수 먹으러 가고싶을정도,kakao
무명칼국수,저는 별로였습니다 바지락 칼국수의 국물은 혼다시 맛이 강하고 닭칼국수의 맛은 스톡 맛이 강한게 좀 아쉬운 부분이에요 만두는 잘 싸여져 있는 만두가 아니라 소에 둘러놓은 느낌이라 판에서 땔때 분리가 되더라구요 가장 나은거는 밀가루 입니다 국수 면은 약간 두꺼운 감이 있지만 쫄깃하게 잘 만들고 잘 삶았습니다 만두피도 맛있었고요 하지만 다른 부분이 너무 아쉬워서 다음에는 안 갈듯 싶어요,kakao
무명칼국수,진짜 석계 맛집 친절하시고 깨끗하고 까다로운 입맛 엄마도 자주 가자고 하는 곳 친구들 동네에 놀러오면 여기로 ,kakao
무명칼국수,아이러브무명 양많고 존맛임 일단 침착맨 픽이라 오히려 좋아,kakao
무명칼국수,석계에 몇 없는 맛집,kakao
무명칼국수,국물이 시원해요 우리동네맛집,kakao
무명칼국수,칼국수 시원하니 맛있네요,kakao
무명칼국수,침착맨 추천받고 왔어요,kakao
무명칼국수,항상 맛있는곳  겉절이도 맛있고 최고입니다,kakao
무명칼국수,별주기도  아까운집 소주 후레시 시켰는데  처음처럼 줌 소주시키고 칼국수 나오기전 김치에 한잔 먼을려고 그랬더니 칼국수 나오기전까지  먹지 말라고함 꽝꽝꽝 술준비도 안되있고  미안함도 건성건성 다시는 안가야지 엄마 밑에 40대 젊은 남자인데  마인드 꽝 비싸고 맛있는집 가야겠다 ㅎ,kakao
무명칼국수,해물칼국수에 미더덕을 넣어 더욱 칼칼 시원 왕만두는 현재 기준 인생 왕만두로 등극,kakao
무명칼국수,칼국수해적단 승,kakao
무명칼국수,행애애애앵님 너무 맛있구만유,kakao
무명칼국수,Chim Chak Man Brings Me Here,kakao
무명칼국수,20년 전통의 칼국수 맛집 닭칼국수의 쫄깃한 수타면발은 훌륭하지만 국물이 너무 묽고 밋밋하다,kakao
무명칼국수,존맛탱 동네 주민인데 일주일에 한번은 가는듯,kakao
무명칼국수,맛과 가격 모두 괜찮은 집,kakao
무명칼국수,너무 맛있는데 가격까지 저렴해요 ,kakao
무명칼국수,직접뽑은면발 닭 바지락 모두 훌륭,kakao
연어시장 석계본점,연어 시장의 존재를 알고부터 한 달에 한 번은 꼭 먹고 있습니다 연어랑 불초밥도 함께 다들 먹어주세요ㅜ 떡볶이도 맛집이에요,kakao
연어시장 석계본점,생각보다는 작은 점포지만 퇴근후 술한잔 편하게 마시기 좋은곳이다,kakao
연어시장 석계본점,연어 배터지게 먹고싶을때 항상 방문하는 집 사람은 엄청 많지만 그만한 이유가 있음,kakao
연어시장 석계본점,퀄리티가 많이 떨어집니다 특히 참치는 추천하지 않습니다,kakao
연어시장 석계본점,연어가 신선하네요,kakao
연어시장 석계본점,우연히 알게돼서 혼자 먹으러 갔는데 무한리필은 2명 이상부터 가능하다고 해서 그냥 돌아왔습니다 혹시나 해서 오기 전부터 인터넷으로 메뉴도 확인하고 메뉴 사진도 봤는데 그런 얘기는 적혀있지 않아서 왔는데 최소인원에 관한 것은 메뉴에도 기입해주시길 바랍니다 다른 식사 메뉴를 먹을 수도 있었지만 솔직히 무한리필이라고 해서 갔던 것인데 따로 공지되지도 않았던 최소인원 제한으로 먹지 못했던 것이 기분 좋지 않아  그냥 나왔습니다,kakao
연어시장 석계본점,연어 너무 맛있어요 그리고 직원분들이 친절해요,kakao
연어시장 석계본점,연어맛집 연어매운탕도 맛있고 기본전이랑 떡볶이도 좋아요ㅎㅎ,kakao
연어시장 석계본점,맛있어서 멀리서 여기까지 자주 갑니다ㅎㅎ,kakao
연어시장 석계본점,맛있고 친절하시더라구요 무한리필 시켜서 리필하더라도 회가 상태가 비슷한게 좋았어요,kakao
연어시장 석계본점,맛있고 친절하시고 좋아용 연어무한리필 라면,kakao
연어시장 석계본점,단 맛이 도는 그 기름기 머금은 연어가 무한 맛있는데 후반 갈 수록 이 느끼함을 달래줄 무언가를 찾게 됨 아쉬운 건 사이드 총합 가격이 조금 ㅠ,kakao
연어시장 석계본점,3월에 하루 무한리필 중단 하고 다음날부터 계속 무한리필 하고 있어요 여전히 매일 작업 합니다  단품 주문해도 떡볶이전샐러드 더 드리고 단품 500g도 생겼어요  8월21일 월부터ㅈ인스타블로그 이벤트 합니다초밥 4ps or 음료  무한리필 하냐는 문의가 많아 올립니다 항상 건강하시고 행복하세요,kakao
연어시장 석계본점,사이드 정말 맛있고 첫번째 연어는 신선하고 맛있었는데 리필 했을때는 좀 아쉬웠어요ㅠ,kakao
연어시장 석계본점,연어 신선하고 맛있어용,kakao
연어시장 석계본점,지금은 무한리필을 안하신다고 합니다 금요일마다 바뀌니 연락 해보고 가세요,kakao
연어시장 석계본점,맛나고 직원들도 친절해요 어디선가 식초냄새가 훅훅 심하게나는데 요것만 없음 더 완벽할 것 같아요,kakao
연어시장 석계본점,맛있어요 진짜 서비스도 좋구,kakao
연어시장 석계본점,몇년째 가는데 항상 맛있어요,kakao
연어시장 석계본점,수원 연어 무한리필도 가봤는데 여기가 차원이 다른 거였음 부위도 다 다르게줘서 먹는 맛이 있고 리필되는 것고 퀄 차이 많이 못 느낌,kakao
연어시장 석계본점,이미 단골이에요,kakao
연어시장 석계본점,리필할때마다 퀄리티 확확 떨어지는게 눈에 보이네요 사진처럼은 한두번 군자역 연어시장이 훨씬 괜찮습니다 웬만하면 그리가세요,kakao
연어시장 석계본점,약 2년 전 평일외출때 갔었는데 쫀마탱,kakao
연어시장 석계본점,첫판만좋지 그이후로 비리고 냄새나고 먹고나면 항상 설사하는집 ㅠㅠㅠ이젠안가요,kakao
연어시장 석계본점,서울에 이만한 연어 무한리필집 없다 심지어 가격도 다른집들보다 저렴함,kakao
연어시장 석계본점,백번은 갔을 듯 평 한번도 남겨보지 않아ㅆ믄데 여기는 제 인생맛집이라 남겨봐요ㅠㅠㅠㅠㅜㅜ 데려간 지인들도 결국 다 반해서 다들 각자 자주 가고 그냥 모든게 완벽해요 ㅠ 맛도 있고 가격도 괜찮고 친절하시고 제발 없어지지 말기를 기도 했는ㄷ 상봉점에 또 생겨서 넘 좋아요 사장님 번창하세요,kakao
연어시장 석계본점,신선하고 맛있어요,kakao
연어시장 석계본점,한달에 두번은 가줘야 함 연어 무한리필의 정석 그리고 무엇보다 떡볶이 맛집,kakao
연어시장 석계본점,신선하고 맛있다 최고,kakao
연어시장 석계본점,신선하고 맛있어요,kakao
연어시장 석계본점,연어 무한리필 온갖 곳 다 가봤지만 여기가 최고임 집앞이고 해서 여태 10번은 간듯  쓰다보니까 또가고싶네요 곧 갈게요,kakao
연어시장 석계본점,항상가면 맛있게 먹고왔어요 같이 주는 떡볶이랑 김치전도 맛있움ㅋㅋㅋ 김도 부탁하면 주니까 같이먹음 굿,kakao
연어시장 석계본점,첫번째 접시 연어는 맛있었는데 두번째 접시 언어는 비린내가 심했어요 떡볶이 엄청 맛나요,kakao
연어시장 석계본점,집앞 존엄 맛집 연어 퀄리티 싱싱하고 매우 좋음 가격도 이정도면 가성비 갑이라고 생각 떡볶이랑 김치전도 무한리필인데 넘 좋음ㅠㅠ 최고 제발 없어지지 마라 사장님 번창하세요,kakao
연어시장 석계본점,두툼하게 썰은 싱싱한 연어회로 맛과 가성비 최고입니다,kakao
연어시장 석계본점,너무 만족해요 또 갈거예요 웨이팅 시간이 조금 있는 거 빼고요 ,kakao
연어시장 석계본점,최고여요 맛있는연어 배터지게 먹었어요,kakao
연어시장 석계본점,아는 분 소개로 갔는데 연어 무한중 질 좋은 편에 속함 ㅇㅇ,kakao
연어시장 석계본점,몆 남지않은 연어무한리필집 질 좋음 추가한연어도 질이 굳굳,kakao
한상,장점  모든음식이 간이 슴슴한데도 맛있음 열무 진짜 부드럽고 맛있음 다비우고 나움 열무 원래손도 안되는사람인데 한입먹어보고 4번 리필함 전반적으로 고급스럽고 맛있음 진짜 가성비좋구 고급진맛  그럼에도 불구하고 별 2개인이유 나도 장사하는입장이고 가족중에서도 코스트높은 식당을하는 사람이있기에 어느정도 공감대가 있어 무례하지만 않다면 앞에서 대놓고 뭐라하지않는편  1사장님의 무례한 주문 석관동에 처음와봤고 오자마자 전망이 너무좋다고 엄마랑 신기해하고있었음 2분정도 뷰에대해 감탄했고 석관동에 이런 뷰가있네하면서 좋아햇음 사장님이 그런와중 메뉴 봐주세요라고 퉁명스럽게 말하심 5분도아니고 2분얘기했어요 더더욱칭찬이였고 그래서 뭘보라고요라고 얘기하니 멋쩍게 웃으며 주문하시라구요 친구들이랑 온것도아니고 엄마랑 온건데 기분이 진짜 나빴음  2사장님의 무례하고 몰지각한 서빙 그렇게 열심히 써치하고 간 집이 아니기에 큰 식탁에 식탁만한 상을 밀어서 얹는 구조라고 생각하지못함 알려주지도않음 그냥와서 물컵치워주세요라고 한뒤 그 큰상을 말도없이 상으로 밀어버림 소리도심했고 본인은 퍼포먼스라고 생각하는것같은데 그냥 짐승밥 밀어넣어주는느낌 가장 상에서 아주 가깝운 의자에 엄마 가방이 있었고 엄마가놀래서 가방을 붙잡음 2천만원짜리 가방임 가방가격이 중요한게아니라 태도를 지적하는것떨어지거나 했음 영수증보여주고 변상받음 그만이지만 눈이있으면 누가봐도 상바로옆에 가방이있는데 너무 놀랐음  사람가방이 가까운곳에 있거나 상을 그렇게 세게 개밥주듯이 밀어올릴꺼면 말을하고 올려야지 군대교관이 따로없음 진짜 무례함과 몰지각이 이루 말할수없음  3앞접시의 불청결 기분까지 조진상태에서 앞접시에 이물질이 너무심했음 딜리버리는 사장이했고 사과는 직원이와서함 자기 가게면 지가 체크해야했다생각함  사과하신직원분이 너무친절하셨고 사장님이 요리다하신거고 낯가리는 성격이셔서 좀그렇다 그래두 음식 다직접하시고 열무가 맛있는이유도 직접재배하신거라 맛난거라 말씀하심 직원분께사장님때문에 기분상했는데 덕분에 잘먹었다고 팁도드림 이분덕에 또 갈것 이분없으면 내 전재산걸고 여기망할듯 음식금액을 올리고 마음공부하세요   음식은 대장금뺨치게 잘하시는듯 진짜 맛있음  상견례 키워드는 빼야할곳이고 음식이 좋음 부엌에서 안나오시는게 어떨까싶음 본인직원에게도 말투가 무례하신걸보니 그냥 천성이 본인바께 모르는듯   맛있었고 또갈것이나 또 날자극한다면 똑같이 무례하게할예정 부디 절 기억해주세요 저처럼 무례한걸 싫어하시는 분은 비추천  전 음식맛은 대만족이라 싸워서라도 또 먹으러 가려구요 2만원 추가로 올려도 먹을의향있는맛,kakao
한상,별1개도 아까워요 가지마세요,kakao
한상,한상에서 돌잔치했어요 돌상차림도 한상에다 맡겼고요 준비해주신 돌떡도 넘 맛있었어요 케익과 돌잡이 추가물건 정도만 준비하시면 되세요 결과는 너무 만족스러웠습니다 룸 안도 널찍해서 손님들도 식사하기 좋았어요 유명 부페보다 훨씬 저렴하면서도 음식 맛있고 친절하시고 밑반찬 리필 가능해서 잘 치렀습니다 가족 돌잔치 고민하시는 분들은 망설이지 마세요 메뉴는 기본 한상차림에 테이블 당 갈비찜 한 접시 하시면 좋아요 기본차림에 떡갈비 포함돼 있어서 어린이 손님에게도 적합합니다  참 지하주차장이 잘 돼 있어서 더 좋습니다,kakao
한상,호불호가 갈리는 집이랄까  음식은 모두 수제라서 조미료가 안들어가다 보니 맛에대한 평가가 제각각 인듯    떡갈비육회 나물 이것저것 꼬치꼬치 물으니 설명해주셔서 식당 컨셉이 건강식이라는걸 이해했음   듣고 보니 더 맛있음,kakao
한상,음식이 정갈하고 종업원들도 친절해서 좋았습니다,kakao
한상,기대 많이 안하고 갔는데 비빔밥 항상 맛있어요 반찬으로 나오는 도라지 무침도 맛있구여  다만 식당이 너무 휑하고 그래서 ㅎㅎ 좀 쌀쌀하고 그래요 쾌적하고 좋습니다,kakao
한상,가격은 비싼데 나오는 반찬들이 가지수만 많고 그냥 백반집 반찬이랑 다를 바 없음 한정식 아니에요,kakao
한상,상호 그대로 푸짐한한상입니다 근데 1인식사도될까요,kakao
한상,6070대 여자분 사장님이신가요 밥먹으러가서 그분의 지겨운 인생이 내게 묻어온다,kakao
한상,여태까지 가본 곳들중 최악입니다  저런 구성과 맛 양심을 가지고 장사할 생각을 하는것도 신기하고 유지가 되는것도 신기함 여기 별점 한개도 아깝다는 말 절대 공감 여기 괜찮다고 별점주는건 진짜 주인이 작성한거임 절대 가지 마세요,kakao
한상,네이버에 기재된 번호로 전화해보시면 이곳은 장사하기싫어하는곳이 분명해요  그냥 사람을 싫어하는듯  전화응대를 이렇게 하는데 가서도 제대로 된 서비스를 받고올까 걱정이네요 ,kakao
한상,2점은 그렇고 4점짜리 식당은 됨,kakao
한상,맛있던데 이 정도면 평범하게 잘하지 않나 싶습니다 반찬 구성에 대해 말이 많던데 이 가격에 이 정도면 가성비 좋은 것 같아요 서울에 다른집들도 비슷한 것 같은데 뭐가 그렇게 맘에 안 들었는지도 모르겠고요 주변 식당들은 넘 시끌벅적하고 주차공간도 없고해서 저는 여기 자주 찾습니다,kakao
한상,제가 가 본 한정식 집 중에서 반찬 구성이 가장 허접했습니다,kakao
한상,가성비가 좋은편은 아니지만 이정도 평점을 줄 가게는 아닌듯 반찬 전반적으로 간 세지 않아서 속이 편안했고요  사찰음식이 테마인 것 같은데  테마에 맞는 적절한 맛입니다  고층 유리창이라 밖에 공사하긴 하지만 뷰는 트였고요 다만 한정식집 답지 않은 뻥 뚫린 식당같은 분위기와 이 가격에 종이컵은 개선 필요합니다   제가 갔을 때는 젊은 남자 직원분이 꼼꼼이 챙겨주시고 엄청 친절하셨습니다,kakao
한상,가격 대비 최악,kakao
한상,아 마눌 생일이라 예약할려 했는데 후기 보고 도저히ㅠㅠ,kakao
한상,별점 1도 아깝다 가격대비 음식 구성 맛 너무 떨어진다,kakao
한상,가격 대비 넘 좋았어요ㅎㅎ 불친절하다는 이야기가 리뷰에 있는데 아마 여자 사장님인듯 나머지 분들은 다 친절하세요 편하게 한식 먹으러 오기 좋을 것 같아요,kakao
한상,여기 절대 가지마세요 집에서 해 먹을수 있는 반찬만 수십가지 나오고 맛도 별로 입니다컵도 종이컵으로커피도 커피믹스로 주고형편없어요정말 돈이 아깝습니다ㅠ,kakao
한상,성의 없음   생수에 종이컵 반찬 가지수는 많으나 조기생선 몇마리에  집반찬들 뿐 그나마 육회는 맛 있음 추천하고 싶지 않은 가게임 식당 분위기에 맞는 식기류등 사용 권장 커피는 종이컵에 믹스밖에 없음 부모님 모시고 가족식사 자리인데 너무 실망함,kakao
한상,스님 밥상에 색을 입힌다라는 주제로 대상을 타기도 한 한상은 사찰음식에 조예가 깊은 박혜선 대표이사가 음식을 총괄하고 있다 몸에 좋은 음식은 기본으로 먹기도 좋은 음식은 맛도 좋다는 박 대표는 건강한 유기농 식재료를 많이 사용하여 믿음을 주고 있다 사찰 음식으로 요즘처럼 강한 입맛을 찾으시는 분들은 조금은 밋밋할 수 있어 참고 하시기 바랍니다,kakao
한상,반찬구성 꽝이고 식재료 질은 낮고 원가 싼거로만 골라서 반찬구성한듯 육회라고 나왔는데 거무튀튀한 색깔에 먹다남은 재고준거같고 맛도 보통이하네요 오늘은 돈 내지만 다시 오지 못할 업소라 생각됨,kakao
한상,별한개도 아까움 비싸고 특히 너무 시끄러움 룸도 룸이아님 천장이 다 뚫려있는 육회에선 오래된냄새나서 먹지도 못하고  최악입니다  손님을 호구로 아나요 한번 팔면 그만입니까  가족모임같다가 기분상하고 오래된 육회먹고 토하고  다신 안갑니다,kakao
한상,가지마세요 비싸구 맛두 없어요 높은곳이라 뷰만 좋음,kakao
윤스쿡,돈카츠 좋아하는데 여기서 경영식 돈까스 맛있음 게 먹음광운대 정식,kakao
윤스쿡,돈가스 소금후추 찍어먹음 맛있음,kakao
윤스쿡,제 인생 1등 일본식 돈까스 맛집이라 생각합니다 대학가 근처 맛집이라 기대 안하고 친구따라서 가서 먹었는데 너무 맛있어서 놀랐어요 원육 숙성을 잘해서 육질은 부드럽고 돈까스 튀김은 바삭바삭했어요 여기는 등심 따로 안심 따로 최소 두 번은 가야한다고 생각합니다 저는 지금까지 5번정도 방문했습니다  재방문의사 ,kakao
