음식점,리뷰,지도
윤스쿡,안심 돈까스 깍두기 너무 부드럽다 같이 간 아들이 별다섯개라고  특히 특로스가스 최고입니다 친절하시기까지,kakao
윤스쿡,돈까스도 돈까스지만 특히 불맛이 확 나는 제육덮밥이 정말 맛있습니다,kakao
윤스쿡,돈까스가 맛있긴 한데 요즘 돈까스 집들이 상향평준화가 많이 되서 엄청난 맛까진 아닙니다 이 곳의 진가는 파불고기 덮밥인데요 돈까스에 이거 같이 드시면 무조건 만족하실 수 있습니다 둘 정도 인원으로 메뉴 3개 시켜서 1개 반씩 나눠 드시는 걸 추천합니다,kakao
윤스쿡,가격에비해 그렇게 맛있는것도 아닌데 현금할인해준다해서 계좌이체 되냐고하니까 한숨쉬면서 계좌이체는 안돼요 이럼 걍 딴데갈란다 가성비 ㅆㅎㅌㅊ,kakao
윤스쿡,비싼데 진짜 맛있습니다,kakao
윤스쿡,맛있어요 근데 쫌 비쌈,kakao
윤스쿡,모든 메뉴가 맛있습니다 정식도 맛있고 히레카츠도 맛있습니다 히레카츠의 경우 어느 일식 돈가스와 비교해도 뒤지지 않습니다 시간이 지나도 튀김 옷이 눅눅해지지 않고 끝까지 바삭합니다  점심 시간에는 웨이팅이 계단 끝까지 생기기 때문에 점심 시간보다 일찍 혹은 점심 시간보다 늦게 방문하시는 걸 추천드립니다 사실 광운대 학생들과 근처 주민들 모두가 즐기는 식당이라 언제 방문하셔도 손님이 끊이지 않고 들어옵니다ㅎㅎ,kakao
윤스쿡,믿고 먹는 윤스쿡역시 맛있어요 어디가도 이런 퀄리티는찾기 힘들어요 엄지척 할수밖에 없네요,kakao
윤스쿡,맛잇고 친절함,kakao
윤스쿡,ㄹㅇ 맛친놈 쩝쩝박사로서 검증된 맛집임 팡운머 근처 최대 맛집 사장님 아 싸랑해요 아우 3일 연속 간 적도 있음 그냥 가뭄 속 내린 가랑비 그자체인 것이에요 돈까스만 맛있는 줄 알았는데 제육덮밥도 맛있음 하 어이업성 기본 돈까스보단 로스히레 시키는 걸 추천드림 핑크솔트가 최고다 현금 내면 천원 할인해주심 야호 ᕕ ᐛ ᕗ  여기는요 제육정식을 먹어보기 전에는 별점 5점이었다면요 제육정식을 먹어본 뒤론 별점 50점입니다 진짜 개이에요 ㄹㅇ 불맛 확 나면서 양도 많고 밥에 계란후라이에 된장찌개까지ㅠ 이거 안 먹으면 깜빵 감 일찍 열어줘서 1교시 끝나면 맨날 가요 ㅎ 사랑해요 윤스쿡,kakao
윤스쿡,익지 않은 고기가 서브되었는데 대처방안이 1500원 할인된 금액이라  양심이 참 없는 곳입니다  다신 안갈예정입니다 돈까스 고기의 빨간부분과 안익은 걸 구분 못하는사람은 없습니다 참고하세요    저녁에 배탈나서 폭풍설사했습니다 정말 고통스럽네요,kakao
윤스쿡,나는 여기가 1만5천원으로 가격을 올려도 갈 것임 진짜 좋아하는 돈까스집 가격이 1만원대라 부담스럽지만 그래도 맛은 있음 진짜 맛있음  로스 히레 광운대 정식 다 먹어봤는데 로스가 참 맛있음 같이 나오는 와사비랑 같이 먹으면 금상첨화임  광운대 정식은 현금으로 구매하면 할인해주는데 가격이 딱딱 떨어지는 것도 아니고 계좌이체도 안되서 사실상 잔돈이 많이 남아도는거 아니면 그냥 카드결제가 좋음,kakao
윤스쿡,광운대 수업들으러 왔다가 깜짝 놀라고 갑니다 겁나 맛있네요,kakao
윤스쿡,광운대 맛집 중 하나 돈까스도 맛있지만 제육이 특별한집,kakao
윤스쿡,현재 메뉴판 가격입니다  옛날 사진이랑 비교해보니까 가격은 오르고 양은 적어졌네요  맛은 낫배드입니다  별 4개 드립니다,kakao
윤스쿡,안심 등심 치돈 까지 가격 싸고 다 맛있어요,kakao
윤스쿡,제육 된장 세트로 먹었습니다  제육은 불맛이 나고 채소도 신선해서 맛있었습니다  된장찌개도 칼칼허이 소주가 생각날 정도로 맛있었습니다   전반적으로 깔끔하고 사장님도 친절하시고 맛도 좋고  가격도 너무 착합니다  한마디로  윤스쿡 내맘에 쿡,kakao
윤스쿡,돈까스의 끝을 볼 수 있는 곳,kakao
윤스쿡,죄송한데요 여기 돈까스미만잡이에요 비싸면 먹지마세요 내가 다먹게,kakao
윤스쿡,광운대 근처 음식점 개바르는걸로는 모자르고 전국구 맛집으로 나와도 될 정도임 별 6개 없나,kakao
윤스쿡,한끼로 후회 없는 선택,kakao
윤스쿡,아니 250g의 돼지고기를 1만원에 근데 맛있다니  가만 아쉬운 점은 히레가츠 씹다가 입천장이 까짐 ㅎㅎ,kakao
윤스쿡,갈 때마다 한결같아요 최고에요 ,kakao
윤스쿡,이 가격에 이정도 퀄리티라니 우동도 맛있어요 ㅜㅜ사람들 꽉 차는 이유를 알겠네욤 흐흐 낼 또가야지,kakao
윤스쿡,숨은 돈까스 맛집 가격올리고 번화가에서 장사하셔도 될듯,kakao
윤스쿡,솔직히 갓성비  어딜 내놔도 아깝지 않은 퀄리티   정말 최고야,kakao
윤스쿡,팡운머최고맛집,kakao
윤스쿡,좀 비싸지만 질 좋고 맛있어서 돈 아깝지 않아요 가게도 깨끗해요,kakao
윤스쿡,돈까스너무맛있어요 팡대생의 추천맛집,kakao
라체나1907,가지 미트 파스타,kakao
라체나1907,가족 친목모임 간거였는데 조명이 어두워요 글씨 읽을때 눈에 힘이 들어가서 분위기가 아니라 그냥 위기에요  점원분 향수인지 전자담배인지도 너무 진해요 역합니다  크림스프는 크루통맛만 나요 루에 가까워요 후추는 요청하니 주셨어요  파스타는 면이 스파게티니라 소스와 먹기 힘들어요 집게도 불편해요 이게 오일파스타인줄 아시나봐요  미트 소스는 간 돼지고기가 상태가 영 그렇고 가지 한개 정도 쓰는 거 같아요 청양크림 소스는 청양고추가 아니라 베트남 고추가 잔뜩 들어있는데다 크림이 텁텁하고 느끼해요 상대적으로 미트소스가 나아요 재룟값 절약을 잘 하시네요   스테이크는 소금을 너무 많이 뿌렸어요 가니시도 무척 짜요   전반적으로 맛없습니다,kakao
라체나1907,데이트 하기엔 괜찮은 적당히 소소하고 친절하고 아늑한  2인세트  스테이크 280변경  근데 맛은 제 스타일이 아니네요,kakao
라체나1907,다 맛있어요,kakao
라체나1907,석계역에 이런 곳이 있다는 사실만으로 감사할 따름입니다 맛도 가격만큼은 하고요 인당 3만원 정도에 배불리 분위기 좋은 식사할 수 있어요 사진은 레드화이트 와인 엔쵸비 파스타 스테이크예요,kakao
라체나1907,청양 파스타랑 머쉬룸 스테이크 맛있었어요,kakao
라체나1907,친구랑 먹으러 갔었는데 전혀 기억에 남지 안는맛이네요  이 돈으로 더맛있는거 먹으러 가세요,kakao
라체나1907,맛은 있는데 남자 사장이 뭔가 이상함 지인이랑 스테이크랑 파스타 시켰는데 고기가 품절이라 다른거 시켜야한다고 말씀해주심 내 지인은 스테이크 먹으러 온거라 좀 실망했었음 근데 그거 보고 다시 주방에서 나와서 뭐 기분 나쁜거 있으세요 이런식으로 시비트듯이 손님 기분을 파악하려고듦 ㅋㅋㅋ 뭔가 저 말투랑 매너가 기분이 안좋았음  사장과 별개로 파스타는 진짜 개존맛이라 별3개,kakao
라체나1907,크림소스 맛이 좀 달고 뭔가 깔끔하진 않네요 면 삶기는 좋았습니다 너무 매운 고추가 많이 들어가 있고 맛의 밸런스가 안 맞아요,kakao
라체나1907,맛있어요 석계역에 이런 곳이 있다니,kakao
라체나1907,맛은 괜찮아요허나 양이 넘 적어요사이즈업 메뉴도 없고 ㅜㅜ,kakao
라체나1907,맛있어요 석계역에 이런분위기의 가게가 있다니 가성비도 좋고 맛도 좋아요,kakao
라체나1907,진짜 맛있어요 가격대비 훌륭해요 특히 석계역에 이런 맛있고 분위기 좋은 레스토랑이란ㅠㅠ 진짜 귀한것 근데 딱한가지 단점이 모든 메뉴가 좀 매워요ㅠㅠㅠ 안 맵게 해달라고 말씀드리는거 필수,kakao
라체나1907,직원분이 친절하시고  음식의 양도 적당하고 맛있습니다,kakao
